{
  "schema_version": "memory-stability-runtime-snapshot/v1",
  "snapshot_id": "medium-risk-runtime-snapshot",
  "description": "上下文接近模型有效长度，存在一条冲突记忆，预期触发中度纠偏。",
  "created_at": "2026-04-21T02:34:37.201Z",
  "source_profile": {
    "path": "contracts/memory-stability/profile/memory-stability-runtime-profile.json",
    "schema_version": "memory-stability-runtime-profile/v1",
    "created_at": "2026-04-20T16:05:13.779Z",
    "model_profile_count": 2
  },
  "model_profile": {
    "provider": "ollama:gemma4:e4b",
    "model_name": "gemma4:e4b",
    "ccrs": 1,
    "ecl_085": 2048,
    "pr": 1,
    "mid_drop": 0
  },
  "runtime_state": {
    "session_id": "snapshot-medium-risk",
    "model_name": "gemma4:e4b",
    "provider": "ollama:gemma4:e4b",
    "ctx_tokens": 1900,
    "memory_anchors": [
      {
        "memory_id": "project-boundary",
        "content": "[redacted:69780590887f]",
        "importance_weight": 3,
        "source": "runtime-example",
        "inserted_position": "middle",
        "last_verified_at": "2026-04-21T02:34:37.201Z",
        "last_verified_ok": true,
        "conflict": false,
        "authoritative": true,
        "content_redaction": "hash_only",
        "sensitivity": "internal",
        "content_sha256": "69780590887f153f18e37096246151de33ef3af2ff015b058b3382e97490fdd5",
        "content_length": 27,
        "content_redacted": true
      },
      {
        "memory_id": "handoff-next",
        "content": "[redacted:fa0bb1f04a65]",
        "importance_weight": 3,
        "source": "runtime-example",
        "inserted_position": "middle",
        "last_verified_at": "2026-04-21T02:34:37.201Z",
        "last_verified_ok": false,
        "conflict": true,
        "authoritative": true,
        "content_redaction": "hash_only",
        "sensitivity": "internal",
        "content_sha256": "fa0bb1f04a65e8b39915adda0f516cc3e3396d7473296611bf4171420461d315",
        "content_length": 33,
        "content_redacted": true
      },
      {
        "memory_id": "no-fake-data",
        "content": "[redacted:304315499772]",
        "importance_weight": 1,
        "source": "runtime-example",
        "inserted_position": "middle",
        "last_verified_at": "2026-04-21T02:34:37.201Z",
        "last_verified_ok": true,
        "conflict": false,
        "authoritative": true,
        "content_redaction": "hash_only",
        "sensitivity": "internal",
        "content_sha256": "304315499772315aa1eca4aefbd4059044a28df20a75ce127582ccb9597a8851",
        "content_length": 31,
        "content_redacted": true
      },
      {
        "memory_id": "placement-policy",
        "content": "[redacted:a4f08419da82]",
        "importance_weight": 1,
        "source": "runtime-example",
        "inserted_position": "front",
        "last_verified_at": "2026-04-21T02:34:37.201Z",
        "last_verified_ok": true,
        "conflict": false,
        "authoritative": true,
        "content_redaction": "hash_only",
        "sensitivity": "internal",
        "content_sha256": "a4f08419da822a36f7afabaa5b6aa2a13ebd5e4a22c42baf3569bb0cc5429065",
        "content_length": 22,
        "content_redacted": true
      }
    ],
    "checked_memories": 4,
    "conflict_memories": 1,
    "v_t": 0.625,
    "l_t": 0.9277,
    "m_t": 0.75,
    "r_pos_t": 0,
    "x_t": 0.25,
    "s_t": 0.5806,
    "c_t": 0.4194,
    "correction_level": "medium",
    "computed_at": "2026-04-21T02:34:37.201Z"
  },
  "correction_plan": {
    "level": "medium",
    "actions": [
      "reanchor_key_memories_near_prompt_end",
      "raise_memory_injection_priority",
      "rewrite_working_memory_summary",
      "compress_low_value_history"
    ],
    "reason": {
      "c_t": 0.4194,
      "s_t": 0.5806,
      "v_t": 0.625,
      "l_t": 0.9277,
      "r_pos_t": 0,
      "x_t": 0.25
    }
  },
  "placement_strategy": {
    "actions": [
      "compress_before_next_turn",
      "compress_early_and_keep_anchor_density_low"
    ],
    "max_injected_estimated_tokens": 9000,
    "model_hint": "compress_early_and_keep_anchor_density_low"
  },
  "privacy": {
    "mode": "redacted",
    "anchor_content_policy": "hash_only",
    "redacted_at": "2026-04-21T02:34:37.234Z",
    "raw_content_persisted": false,
    "note": "Anchor content is replaced with a deterministic hash marker for storage and replay without raw memory text."
  }
}
